{
  "$schema": "./architecture/schemas/titmas-cs-d02-pre59-qwen-prompt-contract-revision-decision-record.schema.v0.1.json",
  "document_id": "DBA-TITMAS-CS-D02-PRE-59-QWEN-PROMPT-CONTRACT-REVISION-DECISION-0.1",
  "version": "0.1.0",
  "status": "QWEN_PROMPT_CONTRACT_V0_2_REVISION_AUTHORIZED_NOT_EXECUTED",
  "decision_id": "CS-D02-PRE-59",
  "standing_directive_reference": "TITMAS-CS-STANDING-001",
  "recommendation_reference": "TITMAS-CS-D02-PRE-59-QWEN-PROMPT-CONTRACT-REVISION-RECOMMENDATION-v0.1.md",
  "recommendation_sha256": "5f9bb464aac3478496a9dc7a0a5249bd98c5701b7a1c66b1e5640f1a210bb658",
  "recommendation_commit": "4a63ce02688923e2ae4d31126b4c835beb635930",
  "decision_result": "ADOPT_QWEN37_PROMPT_CONTRACT_V0_2_AS_BOUNDED_RERUN_DEVELOPMENT_BASELINE",
  "decided_by_ref": "zhangbin",
  "decided_at": "2026-07-27T09:16:05+08:00",
  "executed_by": "Codex",
  "standing_directive_eligibility": {
    "canonical_recommendation_present": true,
    "single_exact_revision_present": true,
    "pre58_diagnostic_bound": true,
    "development_scope_explicit": true,
    "offline_scope_explicit": true,
    "zero_network_explicit": true,
    "zero_credential_reads_explicit": true,
    "preconditions_directly_evidenced": true,
    "all_effect_classes_declared": true,
    "stop_conditions_explicit": true,
    "later_conflict_absent": true,
    "independent_decision_record_present": true
  },
  "scope": {
    "primary_repository": "digital-biosphere-architecture",
    "input_commit": "4a63ce02688923e2ae4d31126b4c835beb635930",
    "output_files": 9,
    "prompt_semantic_changes_max": 1,
    "provider_network_requests_max": 0,
    "live_model_requests_max": 0,
    "credential_reads_max": 0,
    "source_history_mutations_max": 0,
    "external_repository_writes_max": 0
  },
  "effects_before_execution": {
    "live_rerun_authorized": false,
    "provider_supported": false,
    "provider_integration_authorized": false,
    "security_review_authorized": false,
    "security_review_completed": false,
    "implementation_authorized": false,
    "runtime_authorized": false,
    "agent_authorized": false,
    "entity_authorized": false,
    "permission_granted": false,
    "source_history_changed": false,
    "commercial_offer_authorized": false,
    "certification_authorized": false,
    "release_authorized": false
  },
  "next_gate": "CREATE_VALIDATE_AND_REMOTE_FREEZE_EXACT_NINE_FILE_PRE59_PACKET",
  "result": "NOT_EXECUTED"
}
